id,description,name,url,image
1,"*Welcome to CourseProviderX!*\n\nWe offer a diverse range of courses to help you enhance your skills and knowledge. Our experienced instructors are dedicated to providing top-notch education in various fields.","CourseProviderX","http://example.com/course-provider-x",https://www.wildfish.com/logo-icon-w.svg
2,"**Explore the world of learning with CourseHub!**\n\nAt CourseHub, we believe in making education accessible and enjoyable. Our courses cover a wide array of subjects to cater to your learning needs.","CourseHub","http://example.com/course-hub",https://www.wildfish.com/logo-icon-w.svg
3,"_Unlock your potential with SkillMasters!_\n\nSkillMasters is committed to empowering individuals through comprehensive and interactive courses. Join us on the journey of continuous learning.","SkillMasters","http://example.com/skill-masters"
4,"# Learn, Grow, Succeed with TechAcademy!\n\nTechAcademy is your gateway to mastering technology. Our courses are designed to equip you with the skills needed in today's digital landscape.","TechAcademy","http://example.com/tech-academy"
5,"[Envision Learning](https://example.com/envision-learning)\n\nEnvision Learning provides innovative and personalized courses to help you achieve your educational goals. Explore a world of possibilities with us!","Envision Learning","https://example.com/envision-learning",https://www.wildfish.com/logo-icon-w.svg
6,"Discover new horizons at EduWorld! Join us for a transformative learning experience.","EduWorld","http://example.com/edu-world"
7,"Enhance your skills with CodeMasters! We provide hands-on coding courses for aspiring developers.","CodeMasters",""
8,"Dive into the world of languages with LinguaVista. Learn, practice, and master new languages.","LinguaVista","http://example.com/lingua-vista"
9,"Achieve academic excellence with StudySphere. Your path to success begins here.","StudySphere",""
10,"Explore the wonders of science at SciTechEd. Engage in exciting experiments and discoveries.","SciTechEd","http://example.com/sci-tech-ed"
11,"Embark on a journey of creativity with ArtExpress. Unleash your artistic potential today!","ArtExpress",""
12,"Connect with the business world through BusinessPro. Develop essential skills for success.","BusinessPro","http://example.com/business-pro",https://www.wildfish.com/logo-icon-w.svg
13,"Join the fitness revolution at FitZone. Achieve your health and wellness goals with us!","FitZone",""
14,"Unlock the secrets of the universe at AstroLearn. Astronomy and beyond, explore the cosmos.","AstroLearn","http://example.com/astro-learn",https://www.wildfish.com/logo-icon-w.svg
15,"Empower your mind with MindMastery. Harness the power of mindfulness and cognitive skills.","MindMastery",""
16,"Discover the world of finance with FinTechAcademy. Stay ahead in the dynamic financial landscape.","FinTechAcademy","http://example.com/fintech-academy"
17,"Ignite your passion for literature with BookNook. Immerse yourself in captivating stories.","BookNook",""
18,"Learn the art of cooking at CulinaryCraft. From basics to gourmet, master the culinary arts.","CulinaryCraft","http://example.com/culinary-craft"
19,"Unleash your musical talent with MelodyMasters. Explore the world of music and creativity.","MelodyMasters",""
20,"Navigate the world of IT with InfoTechPro. Stay updated on the latest tech trends and skills.","InfoTechPro","http://example.com/infotech-pro"
